id_pesquisador, nome_artigo, ano_publicacao, DOI, journal_ou_conferencia, numero_pesquisadores
0030831394823125, Vertical Interincisal trespass assessment in children with speech disorders, 2008, , Brazilian Oral Research (Impresso), 5
0030831394823125, Tratamento ortodôntico precoce da mordida cruzada anterior e posterior: relato de caso clínico, 2003, , JBP. Jornal Brasileiro de Odontopediatria & Odontologia do Bebê, 5
0030831394823125, Prevalência de agenesia dentária em pacientes ortodônticos da cidade de São Paulo, 2006, , RPG. Revista de Pós-Graduação (USP), 5
0030831394823125, Avaliação da aplicabilidade da análise de carrea na dentadura decídua, 2005, , JBP. Jornal Brasileiro de Odontopediatria & Odontologia do Bebê, 5
0030831394823125, Utilização dos arcos seccionados para o tratamento da má oclusão de Classe II, divisão 2, 2009, , Revista Dental Press de Ortodontia e Ortopedia Facial (Impresso), 3
0030831394823125, Rev. clín. ortodon. Dental Press, 2009, , Revista Clínica de Ortodontia Dental Press, 3
